{
  "schemaVersion": "1.0.0",
  "sourceMode": "GPT_WEB_IMPORT",
  "generationLevel": "STANDARD",
  "testCases": [
    {
      "tcId": "TC_001-001",
      "minorCategoryNo": 1,
      "tcSeqNo": 1,
      "majorCategory": "회원관리",
      "middleCategory": "로그인",
      "minorCategory": "일반 로그인",
      "scenario": "유효한 계정으로 로그인한다.",
      "precondition": "로그인 화면에서 정상 계정의 아이디와 비밀번호를 입력한다.",
      "expectedResult": "메인 화면으로 이동하고 로그인 사용자 정보 또는 로그아웃 버튼이 표시된다.",
      "reviewStatus": "DRAFT",
      "automationTarget": true,
      "automationReason": "URL 접속, 입력, 버튼 클릭, 화면 문구 확인으로 자동화할 수 있다.",
      "riskLevel": "LOW",
      "riskFlags": [],
      "generationReason": "로그인 기능의 기본 정상 동작을 확인한다."
    },
    {
      "tcId": "TC_001-002",
      "minorCategoryNo": 1,
      "tcSeqNo": 2,
      "majorCategory": "회원관리",
      "middleCategory": "로그인",
      "minorCategory": "일반 로그인",
      "scenario": "잘못된 비밀번호로 로그인한다.",
      "precondition": "로그인 화면에서 존재하는 아이디와 잘못된 비밀번호를 입력한다.",
      "expectedResult": "로그인에 실패하고 오류 메시지가 표시되며 메인 화면으로 이동하지 않는다.",
      "reviewStatus": "DRAFT",
      "automationTarget": true,
      "automationReason": "입력값 변경 후 오류 메시지와 URL 상태를 확인할 수 있다.",
      "riskLevel": "LOW",
      "riskFlags": [],
      "generationReason": "인증 실패 처리를 확인한다."
    },
    {
      "tcId": "TC_002-001",
      "minorCategoryNo": 2,
      "tcSeqNo": 1,
      "majorCategory": "게시판",
      "middleCategory": "공지사항",
      "minorCategory": "공지사항 삭제",
      "scenario": "공지사항 삭제 기능은 자동 실행 대상에서 제외한다.",
      "precondition": "삭제 가능한 공지사항이 존재한다.",
      "expectedResult": "사람 검토 후 수동으로 삭제 가능 여부를 확인한다.",
      "reviewStatus": "DRAFT",
      "automationTarget": false,
      "automationReason": "데이터 삭제 동작이 포함되어 기본 자동 실행 대상에서 제외한다.",
      "riskLevel": "HIGH",
      "riskFlags": ["DELETE_DATA"],
      "riskReason": "실제 데이터 삭제 가능성이 있다.",
      "generationReason": "위험 동작을 검토 대상으로 분류한다."
    }
  ]
}
